SynonymsYour guide to the best in software for small businesses.Last Updated: April 2, 2018
Copyright  The Regents of the University of California, Davis campus. All rights reserved.A new Sales Associate job is available in Tulsa, Oklahoma. Check it out on NRF Job Board.Visit the post for more.Credits:
2-3
The law applicable to the sale of goods, including bulk transfers, with emphasis on the legal devices utilized in the distribution of such property.
Search & register domain names along with web hosting, website builders, SSL certificates, premium & expiring domain names, and new domains.Help the ACLU defend and preserve our rights and liberties by wearing clothing and accessories to spread the word. Your purchase helps defend the constitutional rights of all people.21 Sale MotoCMS Ecommerce Templates on TemplateMonsterNew Insights on How We Shop
 Were making our lists and checkingthe price tags twice! Are we getting the best deals? Do we buy smarter when we visit the store or peruse online? Derick Davis, Assistant Professor of Commerce in the McIntire School of Commerce at the University of Virginia, details the psychology behind how we approach holiday shopping.  []
Connect With UsSales representative definition, a person or organization designated by a company to solicit business on its behalf in a specified territory or foreign country: I suggest you contact our Chicago sales representative. See more.Shop the sale department and save on your favorite Baltimore Sun merchandise, back issues, reprints, books & apparel at the Baltimore Sun Official Store!Apply to be a Sales Representative  in Harrison, NY on the Patch Jobs board.Latest news -  Sale, Photos -  Sale, Videos -  Sale. Sale updates on Rediff NewsThe latest tips and news on Sale are on POPSUGAR Pets. On POPSUGAR Pets you will find everything you need on pets and Sale.Links for Sale to find information on homes and propertyEnvato Elements is celebrating its 2nd birthday, and you can join in the fun by locking in a low $19
bySyba Signs is Australia's and New Zealand's leading supplier of library signage to schools. Find us online.About this store
The Blender Store is being operated by Blender Institute in Amsterdam, the Netherlands.
Revenues of the store are being used to support Blender projects - open movies and software development and organising the Blender Foundation duties.
: we guarantee 100% customer satisfaction. Contact us at
shop at blender.org
and we help you right away!
CurrencySale News - Find Sale latest News and Headlines today along with Sale Photos and Videos at HindustanTimes.com. All Sale News updates and notification on our Mobile App available on Android and ITunes.Explore Sale holidays and discover the best time and places to visit.Define sales representative. sales representative synonyms, sales representative pronunciation, sales representative translation, English dictionary definition of sales representative. Noun 1. sales representative - a person employed to represent a business and to sell its merchandise sales rep, salesperson sales demonstrator, demonstrator...Sale videos and latest news articles; GlobalNews.ca your source for the latest news on Sale .Marks & Spencer LondonStories and news about sale from GeekWirePlease fill the details to complete Sign In
Email:Find homes for sale and real estate at Keller Williams RealtyFrom Zoe Ball to Emilia Fox, celebs love the Cowshed spa and products from Babington House. And you can treat yourself to a little A-list action in
Hot Topics:Employer: Leading Building Materials Distributor, Location: Saint Paul, Minnesota, ID: 354755, Date posted: 5/8/2019Posts about sale written by Rusty Blazenhoff and Maggie Koerth-BakerIsihumusho segama elithi sale | The sale of the house fell through when the buyer couldn't secure a loanStay tuned to Complex for new Sale content daily.License the song Sale by Silence.  Available for commercial use for any multimedia project (video, advertising).  Royalty free music.Book Sale, PhotographyGet the latest Sale news, videos and headlines. Explore more for Sale breaking news, opinions, special reports and more on Livemint.Posts about Sales Associate written by Messe Frankfurt North AmericaUse BambooHRs sales associate job description template to list your job opening faster and find the right candidates for your sales associate position.Posts about sale written by VFILESSale - Gaming Reviews, News, Tips and More. | KotakuThe Voice of America is one of the world's most trusted sources for news and information from the United States and around the world. VOA is a multimedia news organization using radio, television, and the internet to distribute content in 45 languages.Sales Associate in New York , Experienced (Non-Manager), Sales, Sales & Business Development with Bloomberg. Apply Today.BestProducts
A Part of Hearst Digital Media
Popular Mechanics participates in various affiliate marketing programs, which means we may get paid commissions on editorially chosen products purchased through our links to retailer sites.
2018 Hearst Communications, Inc. All Rights Reserved.Find our Sales Associate job description for NFP located in Napa, CA, as well as other career opportunities that the company is hiring for.Sale! TV Show - Australian TV Guide - The AgeShare Pass has been a tremendous success; having sold millions of Share Pass rides in a matter of months. If you havent experienced it for yourself yet, then we have an exclusive deal to get you started.
Get your Share Pass for 10 rides at attractive prices:
Share Pass brings increased predictability and convenience to your everyday travel, making your commute easier, comfortable and pocket-friendly. With Ola Share Pass, you enjoy flat fixed fares on your Share rides without peak pricing irrespective of time and day.
How to buy your Share Pass for free:
So hurry now and buy your Share pass before you forget!
Terms & Conditions:
This is a one-time offer
The renewal of this pass shall happen at the price prevailing at that time
Offer valid for a single purchase of 10 ride pass for any one of the 8 km / 12 km / 16 km categories of Share pass in Bangalore
Ola reserves the right to withdraw/modify the offers at its own discretion
This entry was posted inAccess all the latest press releases and statements from the Which? press office. Contact us for media enquiries and interview requests for our spokespeople.Find Sale apartments for rent. View photos and maps of Sale. See the best Sale apartments for walking, biking, commuting and public transit.Stock up for the festive season with Cancer Research UK's unique selection of Christmas gifts & decorations. And with all profits going towards cancer research, you'll be sharing something more meaningful this year.
December 13, 2017 AT12:00pmI took advantage of the sale items + my 10% coupon and bought the ABH Prism Eyeshadow Palette and the ABH Aurora Glow Kit. With the discount, the total was $49.95. Are these items any good because I own the MR palette and I LOVE it!See an archive of all sale stories published on The CutO2 UK blogCheck out all the champs and skins on sale this November!
1 hour ago
April bundles are here for a limited time.
6 months ago
Chromas, new Mystery Minis, and more will be purchasable with Blue Essence from April 20  May 1, 2018.
6 months ago
Check out all the champs and skins on sale this March!
8 months ago
February bundles are here for a limited time.
8 months ago
The Mighty Jax, Curling Veigar, and the rest of the Winter Games skins have returned to the League store for a limited time.
8 months ago
From now until February 7th, Annie content, new and old, is available in the store. We are opening the vaults for all legacy Annie skins, and have created two unique summoner icons to commemorate Annies story.
8 months ago
Check out all the champs and skins on sale this February!
9 months ago
Check out all the champs and skins on sale this January!
10 months ago
Dawnbringer Riven, Nightbringer Yasuo, and more are on the December Early Sale list!
10 months agoFilterSort ByFeatured ItemsPrice: Low to HighPrice: High to LowCustomers' Top RatedBest SellersNew ArrivalsAll Items (4440)Free PickupSort byFeatured ItemsPrice: Low to HighPrice: High to LowCustomers' Top RatedBest SellersNew ArrivalsApply for Sales Representative job with Thermo Fisher Scientific in Osaka, Japan. Sales at Thermo Fisher ScientificFind the latest Architectural Digest homes for sale articles, see the gorgeous architectural pictures and slideshows, and get design ideas from the top design authority.School of Computing and
                            Information Sciences11200 SW 8th Street
                            CASE 354
                            Miami, FL 33199Tel: 305-348-2744Fax: 305-348-3549Search and apply to our open sales representative jobs . Our full-time, freelance and temporary sales representative roles  are updated daily. 2018 Washingtonian Media Inc.
All Rights Reserved.
Washingtonian is a participant in the Amazon Services LLC Associates Program, an affiliate advertising program designed to provide a means for sites to earn advertising fees by advertising and linking to Amazon.com.Want to create or improve your Sales Representative resume? Check out VisualCVs sample resumes for guidance & find the right template for the job.Sales Representative - NL F5 Networking ApSThe student media organization of California State University NorthridgeSales Associate Jobs at Goodwill San Francisco, San Mateo, Marin | Goodwill San Francisco, San Mateo, MarinJob Duties / Responsibilities  Assist the Spine Specialist on field calls for assigned geography and address any problems that arise on the account Ensure that all NuVasive sets/trays are restocked...Apply to Sales Representative at HostPapa in Burlington, Ontario, Canada.Scroll.in is an independent website covering news, politics, sports, culture and everything in between. Get the latest news, reportage, analysis and commentary on all that matters in India and beyond.Homes For Sale in Boise IDLunarpages Internet Solutions, a leading internet solutions provider, is seeking a self-motivated B2B and B2C sales representative with excellent prospecting and lead generation skills.We're looking for a competitive, passionate, and goal oriented Sales Representative to join our fast growing company Job responsibilities  Sales experience in Joinery and fit out works such as Wooden Kitchens, Doors, Cabinets    Cladding.  Meet with new potential clients to determine their needs&#133Dear Candidates, We are looking for a outdoor sales representative. Products: Carpet,Curtains,Furniture,Fabric. Required: Good Interpersonal and Communication skills. Sales Representative in Accounting and public practice, Accountant with NCH Europe. Apply Today.Sales Associate Job Description - How to Become a Sales Associate | SnagajobView details and apply for this sales representative job in London with Park Street People on totaljobs. An award winning online marketplace Great training and development potential Good earnings capability Why you want to work here: An award winning online marketplace Great opportunity to really develop your sales skills Great training and development potential Good earnings capability Brilliant working environment and being part of a new high profile team Day to day responsibilities: Engaging with prospective companies to trial being part of the B2B online marketplace through outbound calling Building rapport and selling the benefits of the platform as a further revenue stream Manage call data and update CRM systems including Salesforce What you need to apply: A proactive attitude and a hunger to be successful and make sales Previous experience in outbound customer service/B2B calling, telemarketing, telesales, lead generation First class communication and relationship building skills Online research skills Excellent time management/organisational ability Park Street People Ltd does not discriminate on the grounds of age, race, gender, disability, creed or sexual orientation and complies with all relevant UK legislation.Sales Representative in Retail and Sales with Cavendish Maine Recruitment. Apply Today.Perfect Search Media is hiring for a Sales Representative  in Chicago. Find more details about the job and how to apply at Built In Chicago.Want to work for the "Most Admired Company" and one of Canada's Best Employers"?
Want to earn 6 Digit figure with Base Salary?&nbsp;

Our client currently has opening for a Sales Representative to focThe Walker Art Center is seeking a part-time
Sales Associate
for greeting visitors, sharing our story, and helping ensure extraordinary experiences and repeat visits. The Walker places the highest priority on establishing a warm and welcoming environment to all of our visitors.
Responsibilities Include:
Excellent customer service: greet, recommend merchandise, assess needs, listen to/respond, and close sales. Actively engage with all customers  provide information and direction to visitors/shoppers, as needed.
Sell art books, artist designed jewelry, contemporary gift items, and memberships.
Provide positive, enthusiastic and welcoming environment.
Schedule and Compensation:
Part-time (15-20 hours/week) with flexibility to work evenings and weekends required.
$10.55/hour, Walker membership, museum discounts, and the opportunity to work alongside talented individuals and support remarkable artists, events and programming.
Qualifications:
Excellent customer service skills and cash register/cash handling experience is essential.
An appreciation of contemporary art is preferred.
A clean, professional appearance.
Ability to stand for extended periods of time (6+ hour shifts) and lift/push/pull up to 25lbs.
Excellent customer service, communication, and interpersonal skills required.
Must be detail-oriented, responsible and dependable.
To Apply:
jobs@walkerart.org
.
The Walker is committed to being an inclusive workplace as well as increasing diversity in our workforce. We are an EOE/AA employer dedicated to fair and inclusive employment practices for all individuals.Copyright  2019 JournalStar.com. All Rights Reserved
You are receiving this message because your email address has been registered with JournalStar.com.Learn more about applying for Sales Representative at MONSANTOSales Representative in Permanent, Aviation and Airlines with Zenon Aviation. Apply Today.Digital marketing is the new Wall Street, and were looking for wolves. Can you sell? Are you willing to travel regularly? Are you willing to work long hours? Are you willing to sacrifice everything to be successful? We are building the best digital marketing salesteam in the world, right here in San Diego. And we...You can submit your resume by visiting this link. If you know anyone who would be a great fit for this position, please pass the link along. Thanks!Sales Representative in Non Food & Drink, Sales with Cavendish Maine. Apply Today.As a Sales Associate, you will operate on the front lines of our sales operation, identifying and developing qualified leads to expand customer growth.Sales Representative in Sales with Anonymous. Apply Today.Apply for Sales Associate job with Foot Locker in Orlando, Florida, United States. Verkoop in de detailhandel at Foot Locker30 E Canfield. Detroit MI 48201. Main: (313) 961-4060. Advertising: (313) 961-4060. All parts of this site Copyright 2018 Detroit Metro Times.Terms of Use | Privacy and Security PolicySales Representative in Studio Management, Furniture with Bespoke. Apply Today.Level 2 Jobs
What our advertisers say...
Careers in Aquatics has always been the best way for us to recruit staff. It enables us to effectively target teaching staff in a particular field. The pricing is also very reasonable and the service is extremely professional.
Nicola Payne, Assistant Bursar
St Christopher School
A smooth process throughout. Its easy to place an ad, with great support available, and weve made successful appointments using the Gold and Silver packages which always yield high quality applicants.
Sandy Clayton, Business Manager
Camden Swiss Cottage SC
The service was easy to use and elicited an outstanding response from across the swimming world, with quality applicants from Brazil, USA and Europe as well as the UK.
Jeremy Tobias-Tarsh
Hackney Aquatics
Having used Careers in Aquatics for the past 4 years I can honestly say there is no better way to recruit professional and qualified teachers.
Chris Tidey, Managing Director
Hamilton Aquatics
Having applied back in 2014 for a swimming teacher job on Careers in Aquatics, now as the director of the learn to swim in the company, we're expanding and I knew exactly where I wanted to advertise for new teachers to join our team.
Emma Hutchinson, Director of Learn to Swim
Absolute Swimming Academy, DubaiService Available for Antelope Valley Association of REALTORS
Site LinksLearn more about applying for Sales Associate at CB2Search 1 Houses for Sale in Somers, NY, View Property Photos, Open house date, Home value and more in Sulekha, Choose suitable homes from our real estate listings.Get ahead in the hiring game with an effective curriculum vitae that helps you stand out. Use this sales representative CV example to find out what to write.YAD NECHAMA MINDEL  5 Towns Sheitel Gemach  Do a good deed & get a big Mitzvah!  Donate your gently ..
 2019 Copyright JewishPress.com. All Rights Reserved. 2013Sales Representative in Permanent, 25,000 - 29,999, Experienced, non-manager, Sales with Anonymous. Apply Today.Description Position Summary: Responsible for providing exceptional customer service and creating a customer centric environment. This person will als...The Client Our client designs and manufactures high-end electronic devices dedicated to construction site safety. With 80% UK market share, our client installs and maintain anti-collision systems, anemometers, warning obstruction lights and cameras to tower cranes and other lifting machines....Discover the role of sales representative at SUEZ.Theres no doubt the COVID era is reshaping the consumer goods industry, possibly forever. Consumers shift to digital, which had been steadily gaining momentum prior to the pandemic, has ratcheted into overdrive during this time of social distancing and stay-at-home orders. Against this backdrop, the sales cycle continue to get faster, meaning companies looking to []Homes for Sale - Home Team Realty, LLC, Oklahoma City, Oklahoma real estate listings, homes for sale.  Your Oklahoma City Oklahoma real estate resource center, find mls listings, condos and homes for sale in Oklahoma City Oklahoma.Looking for an exciting new opportunity to start your career BC Tree Fruits Cooperative is seeking a driven and motivatedSales Representative in Hardware, Design with IC Resources Ltd. Apply Today.Sales Associate in Permanent, Up to 10,000, Consultant, Hair & Beauty with Hays Specialist Recruitment Limited. Apply Today.Beliebte Websites zu homes for sale, real estate, real estate listings, home, costa rica homes, tyler homes, real estate buying, residential real estate, costa rica properties, land for sale, canadian home find - Social Bookmarking und Web 2.0 Suchmaschine1795 Airport Rd, Breckenridge, 80424 |     01/10/2019 |                  Ad id: 8-0000365261
Details
Sales Associate   Come join the Green  Dragon - Breckenridge Team! FT & PT positions, Must have MED badge   Send resume to
or apply Online at greendragon.com/careers   W I N T E R B O N U S
Street Address:Apply now for Sales Representative jobs at Auto Now Financial Services Inc. in Mesa, AZ. View the Sales Representative job description, share this job and apply online.The latest Sales associate job vacancies in Singapore from all job search sites and listings. Find new job and start your career today.Please enter your username or e-mail address to recover your password.
Hey there!Hiring a sales representative as a contractor? Make sure you have an accurate legal agreement in place.homes for sale businesses ,  ExpressBusinessDirectory.ComFind out about sales representative pay, training requirements and job opportunities in New Zealand.New Career Opportunity! National General Insurance has an opening for a Sales Representative in Hillsboro, ORFind homes for sale, find an agent, view virtual tours, receive homes by e-mail, learn about buying and selling a home and more!We do one thing that most realtors won't do. We help liquidate the home for sales personal property. If you have improvements to the home needed, we will coordinate quotes for you from three or more sources and present them for you to select what meets your budget. If we run into problems, we solve them with you. We are in this together. We are Legacy Home and Estate Services. We vow to help you move forward while honoring the past.
Email: contact@legacyhomeestate.com
Phone Number: (502)500-0374
Visit:- https://legacyhomeestate.com/Aspen, 81611 |     01/10/2019 |                  Ad id: 8-0000365297
Details
Sales Associate   Come join the Green  Dragon -Aspen Team! FT/PT/Management  positions, MED badge req.   Send resume to
or apply Online at greendragon.com/careers   W I N T E R B O N U S
Job Title:Learn more about applying for Sales Associate at Cox Media GroupSales Representative Jobs | Jobrapido.com. Search all jobs across the world!Just Landed - All you need to live, work and study abroad: Expatriate Information, Country guides, Expats Community, Expatriate Jobs and International Property.Search homes for sale in the Sacramento area with Lyon Real Estate.Learn more about applying for Sales Associate at OneMain Financial1795 Airport Rd, Breckenridge, 80424 |     03/07/2019 |                  Ad id: 8-0000393204
Details
Sales Associate Come join the Green  Dragon - Breckenridge Team! FT & PT positions, Must have MED badge   Send resume to
or apply Online at greendragon.com/careers   W I N T E R B O N U S
Additional DetailsPERMANENT | $35 - $60K | Willamsburg, NEW YORK Acting as the primary public advocate for Artlogic in the US, the Sales & Associate will play a major role in developing Artlogics client base and dramatically improving brand awareness within the United States. With 600 clients globally and over 100...I am number one Minneapolis Realtor , been doing business for over 12 year and is ready to serve you. http://www.herculestherealtor.com/We're looking for a great Sales Representative to join our team at Express Employment ProfessionalsIf you are wondering to fulfill your dream of purchasing a luxury home then at the very beginning congratulations for your new endeavor!
[...]Homes and Land real estate sitemap for available Homes for Sale by state.  Search homes for sale, land for sale, real estate listings as well as homes for rent.  Also find home improvement contractors and real estate agents at homesandland.com.Learn more about applying for Sales Representative at Procter and GambleJoin our diverse, international, fun, smart, user- focused and ambitious team. We are looking for real Rockstars!Information on homes for saleArkansasBusiness.com is the website partner of the Arkansas Business journal.View Sales Representative job vacancies in Leinster and apply online. Find your next great opportunity and ideal job on job search site ie.Jobtonic.org.www.ncell.com.npInternetDevels is a Ukrainian Drupal development shop. We provide offshore software outsourcing services for other digital agencies in North America and deliver web development services to end customers.We have a mature team of Drupal professionals, masters of their craft, looking for challenges and complex works. Position is for sales representative who can make use of this values. Requirements:Find homes for sale, find an agent, view virtual tours, receive homes by e-mail, learn about buying and selling a home and more!What youll be doing: As a Sales Representative, youll play a critical role in DriverReachs growthnot only in the education and development of leads, but also by converting prospects into actionable leads for the Account Executives. Additionally, you will be viewed as an ambassador of the brand by providing company awareness to potential customers. You Confirm your password by entering your phone number.
Confirm Phone
Sorry, we couldnt find '
'

Close
Please check the spelling, try clearing the search box, or try reformatting to match these examples:
Address:
'123 Main St, Seattle, WA'
Neighborhood:For one of our clients, a Japanese LED light manufacturer, we are looking for a Sales Associate to join their Lighting Team. In this function you will be responsible for the day to day interaction with customers in order to provide outstanding customer service and information in response to inquiries about products and services and in particular regarding order to...Apply to Sales Associate at Heath Ceramics in San Francisco, CA.Sign up to receive our latest picture dumps in your e-mail
*Residential Rental  in Dallas, TX.Download Opensooq app on your mobile now, sell and buy for freeWe are hiring! Solar Wolf Energy is seeking ambitious and enthusiastic candidates to fill the role of Sales Representative. This is a commission based position.View company leaders and background information for Homes for Sale. Search our database of over 100 million company and executive profiles.Miami, Florida - We are an industry leading personal development and coaching company whose mission is to inspire, instruct and ignite people to creat 2018 Baird & Warner Real Estate.
