Sales is activity related to selling or the amount of goods or services sold in a given time period.See what items on eBay consist of an interesting Sale collection. Join fatimah.k.a to create inspiring collections on eBay!ETRetail.com brings latest sales news, views and updates from all top sources for the Indian Retail industry.IRS publications
Sales tax publications (by number)
A Publication is an informational document that addresses a particular topic of interest to taxpayers. Subsequent changes in the law or regulations, judicial decisions, Tax Appeals Tribunal decisions, or changes in Department policies could affect the validity of the information contained in a publication. Publications are updated regularly and are accurate on the date issued.
Sales tax publications (by number)
NumberFind Sales listings in San Francisco, CALIFORNIA. Get Sales listings phone numbers, driving directions, business addresses, maps and more.We are Hiring! NIGHT-SHIFT ONLY!!! - With Fixed weekend off -With Good Incentive Package Our Company (Global Container and Chassis) is in need of Sales and Marketing Staff. Job Description: -...Talking Shop in Delaware. Follow TrenDE on Twitter @MargieTrenDE and on Facebook at www.facebook.com/margietrende. Email shopping column ideas to mfishman@delawareonline.com.Are you looking for each day to be different? Are you a positive and motivated person looking to be a part of a culture which redefines excellence? As a Koodo team member, you will be responsible for delivering best-in-class customer service. You will be making genuine connections with every customer while you guide them through choosing the perfect solution for their wirelessSelling St Louis with Unparalleled Service
SearchImport Simple products from VendHQ to WooCommerce and export WooCommerce sales and customers to VendHQ
Sujith222
Fewer than 10 active installations
Tested with 4.9.9Sales Navigator allows you to tap into LinkedIns network to find leads, increase pipeline and close more deals. Login or start your free trial todayExplore Pink Box Accessories's board "Sales" on Pinterest. | See more ideas about The pink.Work at the Wix Sales offices and be part of an awesome and fun teamDownload free stock photos of sales & discount tags on Burst. These royalty-free HD images are perfect for brands advertising new promotions.r/sales: Everything you need to know about sales, selling, business development, lead generation, prospecting, closing and more!Over the road, you will discover the riches of our country through the vineyards, heritage, landscape, orchids, lakes... Hiking guide book : 5,50Quality Mizzou apparel for devoted fans from one alum to Every True Son and Daughter.Green Trailer & Equipment has a growing list of all types of trailers and equipment at each of our locations. We feature tanks byTremcar,Exosent, Dragon andTroxell plus all types of used tankers ready for their next life helping your business grow.We have new and used flats and drops fromWade and Direct, and specialty trailers from Find GIFs with the latest and newest hashtags! Search, discover and share your favorite Sales GIFs. The best GIFs are on GIPHY.Apply for Sales jobs on Guardian Jobs. Browse a great range of Sales job vacancies available today.Get the latest news in the Sale area from BBC News.Our team searches daily for businesses that believe in furthering trust in the marketplace.Sales representative in Other, Sales with mitsubishi. Apply Today.Oracle Learning Subscriptions | Learn Oracle from OracleThe Full CupDenmarks mortgage industry was blindsided in November, when it emerged the London-based EBA would ignore the findings of its own technical study, which showed covered bonds are as liquid as government debt. Photographer: Freya Ingrid Morales/BloombergSite Map
A note about our privacy policies and terms of service:
We have updated our privacy policies and certain website terms of service to provide greater transparency, promote simplification, and align with recent changes in privacy laws applicable to us.The Best of British TV and Culture. Celebrate your favourite shows: Doctor Who, Top Gear, Sherlock, and many more! Shop bestselling DVDs, Blu-rays and merchandise direct from the BBC Shop.84 uploadsSean Prudden
B2B creative can be difficult to produce. Typically, we arent promoting the  conventionally  sexy or trendy products you might see in the B2C or retail world, and cant rely on attractive images of clothing or travel destinations to drive clicks. But that doesnt...
Jan 15, 2015Find the latest Sales news from WIRED. See related science and technology articles, photos, slideshows and videos.Tag Archives:
sales
July 20, 2015  9:31 am
MIT Sloan Associate Prof. Juanjuan Zhang
From Yahoo! Tech
Its the Age of Social Media, and most companies are all in. They vie for likes on Facebook; they post pictures of products on Instagram; and they collect followers on Twitter and Weibo  Chinas popular microblogging site  and regularly post about new services.
And yet, even as companies continue to spend time and money on social media, many are dubious about whether all that posting, tweeting, and retweeting has any effect on the bottom line.
My collaborators from Tsinghua Universitys School of Economics and Management and IOur Sales department is responsible for the commercial development of all our solutions, via different sales channels. Combining customer satisfaction with sales performance, the team makes good use of its knowledge of both users and OVH services. Its main objectives: maximise the value proposition and differentiate OVH in our markets.

With a presence in several countries, our Sales department spans the activities of telesales, direct sales and partnerships with other players in the IT sector. Together with our customers, we are building the future of cloud solutions.

All our vacanciesSales Representative in Sales with Ginger Promotions. Apply Today.Integrate Wistia with your sales tech-stack to to build trust and stronger connections with your leads.Choose from over 200 Premium sale Templates from the #1 source for sale Templates. Created by our Global Community of independent Web Developers.Explore sales campaigns and monthly offers for booksellers and other business partners. Download fulltitle lists, catalogs, banners, and posters.Meet other local Sales Professionals.  Network and discuss sales techniques, strategies, etc.SALE by Morgan Blom. 37 photos.Get the latest sales news, articles, videos and photos on the New York Post.Data and statistics about Sales - Discover
                    the most popular statistics about Sales on Statista!Chemical R&D
CEFIC, a European association of chemical companies, expects Chinas share of the global chemical market to increase further  from the current 39.9% (2015) to 44% in 2030. So, despite the slowdown of the Chinese economy, growth is still faster than the global average.Housing & Travel FAQ
Technology Partners
2018-2019 SXSW, LLC. SXSW, SXSW EDU, and South by Southwest are trademarks owned by SXSW, LLC. Any unauthorized use of these names, or variations of these names, is a violation of state, federal, and international trademark laws.Purchasing printsFind new ideas and classic advice for global leaders from the world's best business and management experts.The latest breaking news, comment and features from The Independent. 2016 Bitly Handmade in NYCMashable is a global, multi-platform media and entertainment company.The transfer of ownership (title) to property in return for money (or another thing of value) on terms agreed upon between buyer and seller.Browse our collection of sales associate information for news stories, slideshows, opinion pieces and related videos posted on AOL.com.The latest news, videos, and discussion topics on Sales - EntrepreneurWant to discover art related to sale? Check out inspiring examples of sale artwork on DeviantArt, and get inspired by our community of talented artists.Code, test &amp; deploy with GitLab. Everyone can contribute!to lose nearly two million bucks. Around midnight, there was a mistake made in the pricing engine that capped everything on the site at $49.95. This only affected merchandise which appears
only
its sister site, Zappos
.
On 6pm, youll find brand-name products at deep discounts. For instance, there was a $1400.00 GPS system available during the snafu for only $49.95 during the six hours of the pricing problem. The issue was discovered  and corrected  by 6am PST that morning. The company states that it will honor all purchases made during that time at the prices which were advertised. The cost of the messup for them is estimated at $1.6 million.
Sister site Zappos uses customer service as their key component of sales. It has paid off well, as its considered to be the biggest online shoe store on the Internet with over a billion dollars worth of sales in the past year. It was acquired by Amazon last year. They claim a large percentage of their sales come from repeat customers who are happy with the company and the way they are treated.By Rachel Williams - November 28, 2018
Tips for getting new clients up and running seamlessly and ensuring retention.
By Rachel Williams - October 19, 2018
How to handle dead deals while leaving room for re-engagement.
By Rachel Williams - September 28, 2018
3 free email templates for better engagement when your prospect goes cold.
By Calendly - September 18, 2018
Equipping business owners with better lead generation capabilities to schedule more meetings and demos.
By Rachel Williams - September 6, 2018
Proven methods to make sure prospects are on time, prepared and excited.
By Rachel Williams - August 16, 2018
Running an effective discovery call as part of your consultative selling approach.
By Rachel Williams - July 31, 2018
Selling your sales meeting is more important than ever before.
By Calendly - July 26, 2018
Hubs are out; tools you love are inwhat modern marketing automation looks like.
By Calendly - April 19, 2018
Insights from three SaaS sales leaders.
1From high-level strategic sales management to primers for non-sales managers, there are a variety of sales-related executive-education programmes available on the Executive Education Navigator. Browse sales programmes by location, date and school. Click 'browse courses' to filter results by price, duration and more. Read our latest sales-related blog post on influencing others.Monitor your site's uptime
for free
With Pingdom's uptime monitoring you are always the first to know when your site is down - at no cost at all! If you have a website, big or small, you need uptime monitoring.Subscribe to Insights
Email address:
I would like to be notified by email of future case studies, white papers, webinars and other educational content
Please consult our
to understand how we protect your privacy.
Nothing Found
It seems we cant find what youre looking for. Perhaps searching can help.
Search for:
Copyright  1995-2018 SAMSUNG All rights reserved.
Posts on this site reflect the personal views of each author and do not necessarily represent the views and opinions of Samsung Electronics America.  Regular contributors may be compensated for their time and expertise.Quartz is a guide to the new global economy for people in business who are excited by change. We cover business, economics, markets, finance, technology, science, design, and fashion.salesby Simon JulianAug 26, 2018by James SpittalNov 02, 2016by Aja FrostMar 31, 2016by Jacob McMillenMar 05, 2015by Adam RobertsJan 19, 2015by Craig BucklerDec 10, 2014by Jacco BlankenspoorMay 12, 2014by John TabitaJul 18, 2013by John TabitaJul 10, 2013by John TabitaJul 02, 2013by John TabitaJun 25, 2013by John TabitaJun 19, 2013by John TabitaJun 12, 2013by John TabitaJun 06, 2013by John TabitaMay 28, 2013by John TabitaMay 21, 2013by John TabitaMay 14, 2013by John TabitaMay 07, 2013by John TabitaApr 30, 2013by John TabitaApr 23, 2013by John TabitaApr 16, 2013Xtreme - Bootstrap 4 Dashboard Template, Osahan Land - Bootstrap 4 Light Theme, Real Estate Professional - Multi and more!Sale at shop.pbs.orgEligible Street View contributors may use the Trusted badge according to the sales and branding guidelines belowRead more about sales from The New YorkerGartner is the worlds leading research and advisory company. We equip business leaders with indispensable insights, advice and tools to achieve their mission-critical priorities today and build the successful organizations of tomorrow.Online Shopping for Cheap Automotive, Phones Accessories, Computers Electronics, Fashion, Beauty Health, Home Garden, Toys Sports, Weddings Events from China; Shopping on Aliexpress |the world's Online Marketing place.Want more Sales Success? Listen to this short bonus episode where Scott Ingram outlines his ideas for 2018 and asks for your help in deciding which one to prioritize next year through the short 3 minute survey available at: top1.fm/2018Don't devote more than 15-20 minutes speaking to candidates. It truly is more than enough time for each of you to dimension up each other and decide regardless of whether you are able to work with one another or not. The rest of the speaking can be done by users of your team. They will train...Article Two of the Uniform Commercial Code is an integrated body of statutory law that prescribes the rights and obligations of parties involved in transactions in goods. Although we will review general principles of contract law and contrast them with the approach adopted in Article Two, this course emphasizes the special techniques of statutory construction utilized in interpreting a code as opposed to an isolated statute. Classroom discussion is devoted almost exclusively to developing analyses of written problems distributed to the students in advance of the class.This page was last modified on 12 December 2008, at 18:19.
This page has been accessed 1,378 times.See how SmartWinnr can help with onboarding, ramp-up of sales teams, new product launch, new service launch and more. Use SmartWinnr as a single channel to train your internal sellers, partners and distributors.Get the latest news, analysis and video updates on Sales from MarketWatchShop our sale for discounts on a range of gifts and souvenirs. Plus get free UK delivery on orders over 50. International delivery options available.Sales on WN Network delivers the latest Videos and Editable pages for News & Events, including Entertainment, Music, Sports, Science and more, Sign up and share your playlists.A sale is the act of selling a product or service in return for money or other compensation. It is an act of completion of a commercial activity. The seller or salesperson  the provider of the goods or services  completes a sale in response to an acquisition or to an appropriation or to Software engineering and technologies that set the world in motionQ&A for ebook publishers and readersExplore exciting Sales career opportunities at Shutterstock.2019 CBS Broadcasting Inc. All Rights Reserved.
Powered bySales - Tech and Science Tips, Reviews, News And More. | Gizmodo|JetBrains, creator of the leading Java IDE - IntelliJ IDEA - is a cutting-edge software vendor specializing in the creation of intelligent development tools.Shop the sale department and save on your favorite Chicago Tribune merchandise, back issues, reprints, books & apparel at the Chicago Tribune Official Store!Policies
Share our living room
AT&T Digital Life only available in select areas in limited markets. AT&T Certified Like New Equipment provided:
used equipment is fully inspected and tested. Equipment fee and monthly service charges apply.
Add a Package:
An addition of an Automation package is an upgrade that requires a new 2-year Automation package agreement with early termination fee.
Early Termination Fee:
After 14 days from installation of service/upgrade customer keeps equipment and early termination fee of up to $640 applies for all alarm monitoring packages (Smart Security; Smart Security & Automation; and Premium Security & Automation). An additional $50 early termination fee applies for incremental automation packages and customer keeps equipment. If cancelling prior to installation or within 14 days of installation, all Equipment must be returned subject to restocking fee.
Restocking Fee:
Up to $99 restocking fee may apply to returned equipment.
Service Restrictions:
Residential customers in residential buildings that are five floors or less. Smoke sensors not available in apartments/townhomes/duplexes. Sufficient wireless signal strength, broadband internet service, and 3-prong outlet at service address required. Digital Life equipment may be incompatible with some homes.
Other Monthly Charges:
Taxes and other charges apply; data charges, surcharges and additional fees may apply.
Prices, features and offers subject to change without notice.
Installation work performed by licensed personnel where required by law. The Digital Life Customer Agreement including Complete Protection equipment warranty terms, and all Digital Life service policies can be read in their entirety and are available atBrowse content tagged with "Sales" on Channel 9.Find & Download Free Graphic Resources for Sales. 43,000+ Vectors, Stock Photos & PSD files.  Free for commercial use  High Quality ImagesI've had four book sales already in the past month. Who are my readers?Strengthen your sales force with our Sales Cloud: Give your sales team the information they need to complete the sale - anywhere, anytime! Use numerous applications from a single source: online CRM, lead management, sales pipeline software and more ...SalesADIDAS - All Day I Dream About Sums..!!
Click here to edit contents of this page.
Click here to toggle editing of individual sections of the page (if possible).         Watch headings for an "edit" link when available.
Append content without editing the whole page source.
Check out how this page has evolved in the past.
If you want to discuss contents of this page - this is the easiest way to do it.
View and manage file attachments for this page.
A few useful tools to manage this Site.
See pages that link to and include this page.
Change the name (also URL address, possibly the category) of the page.
View wiki source for this page without editing.
View/set parent page (used for creating breadcrumbs and structured layout).
Notify administrators if there is objectionable content in this page.
Something does not work as expected? Find out what you can do.
General Wikidot.com documentation and help section.
Wikidot.com Terms of Service - what you can, what you should not etc.
Wikidot.com Privacy Policy.Sale definition is - the act of selling; specifically : the transfer of ownership of and title to property from one person to another for a price. How to use sale in a sentence..UCL HomepageSales!!!
05/14/2013 20:40
We had great sales at the prototype convention last year. We look foward to another great year of sales. We hope you all enjoy our newly launched company.
-The owners of Beautiful BarrettesCreate a custom, compelling sales pitch deck for free with Canva's impressively easy to use online presentation builder.Seamlessly sync deals, leads and conversations with the new Pipedrive app for Intercom
With the Pipedrive app, you can now create deals in Pipedrive as you capture and qualify leads in Intercom, view details about a leads Pipedrive deal right in your Intercom inbox, and automatically send conversations with a lead in Intercom to their profile in PipedriveWordPress.org
Copyright  2015 PwC - All Rights Reserved. Not for further distribution without the permission of PwC.   Should you wish to use any or part of the material from this blog, please contact us in advance.   PwC refers to the PwC network and/or one or more of its member firms, each of which is a separate   legal entity. Please see www.pwc.com/structure for further details.GrowthPress
GrowthPress WordPress Theme by ProteusThemes GrowthPress is a niche Marketing and SEO WordPress Theme from ProteusThemes. It is the ideal theme for promoting products, services or online courses.  GrowthPress offers both wide and boxed layouts, with a mobile-friendly design that adjusts to all devices and resolutions dynamically.  GrowthPress Boxed Layout
Get The Most Out of SiteOrigin with SiteOrigin PremiumSale - Tips, Tricks and Hacks for Doing Everything Better | LifehackerNew Scientist has been keeping scientists and the public informed of developments in science and technology since 1956. New Scientist Jobs builds on this and is the perfect resource for science careers. Discover exciting new sales jobs from great science employers. You can apply now or just save opportunities to look at later on in more detail; you can set up email alerts to make sure you dont miss any opportunities.Globe and Mail coverage about SalesSales & Promotions. Sales & Promotions. Sales & Promotions. Inspiration. Sales & Promotions. InspirationFind Sales Latest News, Videos & Pictures on Sales and see latest updates, news, information from NDTV.COM. Explore more on Sales.Sales representative for working at 123FormBuilder - the web form builder that helps users build any type of web forms and surveys.Free icons of Sales in various design styles for web, mobile, and graphic design projects. Available in png and vector. Download icons in all formats or edit them for your designs.Shop Target for Sale Tea you will love at great low prices. Free shipping on orders of $35+ or same-day pick-up in store.Is it normal for it to take a few days/weeks before you get your first sale?Food . Cook . Recipesscratching auf Acrylglas 50x50cm, mixed media, Glasfarben, Lack, EddingWelcome to the Daily News Official Store! Shop online for Daily News merchandise, t-shirts, clothing, apparel, posters and accessories.3 Replies
Its nearly that time again Black Friday and Cyber Monday are quickly approaching!
Were going to have our award winning virtualization products on sale at huge discounts just in time for the holidays.
If you had been holding off upgrading to Fusion 8.5, our Black Friday and Cyber Monday sales are the biggest discounts we offer all year, its the perfect time to get supported under macOS Sierra and Windows 10 Anniversary (which has been called 
the most secure Windows to date
.
In other news, we also just released a security patch to address a vulnerability demonstrated at this years
festival in Seoul, Korea last week. We patched the vulnerability in hours and pushed the release on Sunday to protect our users.
You can read the release notes for 8.5.2Pinacle Plumbing are a Salisbury based Plumbing Supplies merchants for both Trade and the General Public. We have over 30 years experience in the trade. Friendly, reliable and quality service.Listen to free internet radio, sports, music, news, talk and podcasts. Stream live events, live play-by-play NFL, MLB, NBA, NHL, college football, NCAA basketball, and Premier League matches. CNN, MSNBC, Fox News, ESPN, BBC, NPR.Everything WIRED UK knows about Sales, including the latest news, features and images.Become a successful salesperson by learning what it takes to attract customers and close sales. Master persuasion, lead generation, sales calls, and meetings.See an archive of all sales stories published on the New York Media network, which includes NYMag, The Cut, Vulture, and Grub Street.Christmas in JulyGetting Your Social Media Marketing into Holiday Mode
Mastering Marketing - July 2017 With July temperatures approaching triple digits, its hard to start thinking about holiday marketing plans. For many that would be the Christmas season but, for direct farm marketers, the holidays encompass the Labor Day weekend, a six-week period in the Fall that...Invalid filters given. Details in error message.
102
Invalid data given. Details in error message.
103
Order status not changed. Details in error message.
Examples
Example 1. Work with orders
$proxy = new SoapClient('http://magentohost/api/soap/?wsdl'); $sessionId = $proxy->login('apiUser', 'apiKey');  // Getting list of orders created by John Doe var_dump($proxy->call($sessionId, 'sales_order.list', array(array('customer_firstname'=>array('eq'=>'John'), 'customer_lastname'=>array('eq'=>'Doe')))));   // Get order info 100000003 var_dump($proxy->call($sessionId, 'sales_order.info', '100000003'));   // Hold order 100000003 $proxy->call($sessionId, 'sales_order.hold', '100000003');  // Unhold order 100000003 $proxy->call($sessionId, 'sales_order.unhold', '100000003');  // Hold order and add comment 100000003 $proxy->call($sessionId, 'sales_order.addComment', array('100000003', 'holded',  'You order is holded',  true));  // Unhold order and add comment 100000003 $proxy->call($sessionId, 'sales_order.addComment', array('100000003', 'pending', 'You order is pending', true));  // Get order info 100000003 var_dump($proxy->call($sessionId, 'sales_order.info', '100000003'));
New and noteworthy homes for sale across the country.News and updates from Innovate UKSale > Sight Aids Search Results at CreateForLessRead the latest news and updates on sales, sales information at Business Standard.Sale - PageTurner Comics BlogGet 611 sale plugins and scripts on CodeCanyon. Buy sale plugins, code & scripts from $3. All from our global community of web developers.Get the latest Sale Sharks news, scores, stats, standings, rumors, and more from ESPN.Measure everything mobile, simply and easily.Sale Latest breaking news, pictures, photos and Video News. Find Sale news headlines, photos, videos, comments, blog posts and opinion at The Indian Express.2
[Jyutping]
If I were always satisfied with the situation then, my situation today should be similar to many of my friends who were salespeople around the same time as me, their positions and salaries already at the ceiling mid-high position, with 10 or 8 salespeople under them
